{
  "$schema": "./registry.schema.v1.json",
  "catalogVersion": "1.0.1",
  "status": "discovery",
  "asOfDate": "2026-10-15",
  "releasePolicy": {
    "unknownAllowedDuringDiscovery": true,
    "unknownAllowedAtRelease": false
  },
  "sources": [
    {
      "id": "intuit.api-overview",
      "title": "What you can do with the QuickBooks Online Accounting API",
      "publisher": "Intuit Developer",
      "url": "https://developer.intuit.com/app/developer/qbo/docs/learn/explore-the-quickbooks-online-api",
      "accessedOn": "2026-08-08",
      "notes": "Platform overview for entity categories, common operations, query, batch, CDC, update, and delete semantics."
    },
    {
      "id": "intuit.api-explorer-guide",
      "title": "Get started with the API Explorer",
      "publisher": "Intuit Developer",
      "url": "https://developer.intuit.com/app/developer/qbo/docs/get-started/get-started-with-the-api-explorer",
      "accessedOn": "2026-08-08",
      "notes": "Records the API Explorer as the per-entity authority for supported operations and fields."
    },
    {
      "id": "intuit.linked-transactions",
      "title": "Manage linked transactions",
      "publisher": "Intuit Developer",
      "url": "https://developer.intuit.com/app/developer/qbo/docs/workflows/manage-linked-transactions",
      "accessedOn": "2026-08-09",
      "notes": "Documents API Invoice-void support and linked-transaction effects, and points to the per-entity API reference for the specific request."
    },
    {
      "id": "intuit.reports",
      "title": "Run reports",
      "publisher": "Intuit Developer",
      "url": "https://developer.intuit.com/app/developer/qbo/docs/workflows/run-reports",
      "accessedOn": "2026-08-08",
      "notes": "Reports API overview, endpoint table, response model, and six-month request-range recommendation."
    },
    {
      "id": "intuit.queries",
      "title": "Query operations and syntax",
      "publisher": "Intuit Developer",
      "url": "https://developer.intuit.com/app/developer/qbo/docs/learn/explore-the-quickbooks-online-api/data-queries",
      "accessedOn": "2026-08-08",
      "notes": "Query language and pagination behaviour, including default 100 and maximum 1,000 entities per response."
    },
    {
      "id": "intuit.limits",
      "title": "API call limits and throttles",
      "publisher": "Intuit Developer",
      "url": "https://developer.intuit.com/app/developer/qbo/docs/learn/limits-and-throttles",
      "accessedOn": "2026-08-08",
      "notes": "Published request, batch, timeout, entity-response, line, link, and attachment limits."
    },
    {
      "id": "intuit.batch",
      "title": "Batch operation",
      "publisher": "Intuit Developer",
      "url": "https://developer.intuit.com/app/developer/qbo/docs/learn/explore-the-quickbooks-online-api/batch",
      "accessedOn": "2026-08-08",
      "notes": "Batch-operation guide; its ten-payload wording conflicts with the current limits page's recommended maximum of thirty and requires resolution before setting operation budgets."
    },
    {
      "id": "intuit.preferences",
      "title": "What customers can do with QuickBooks Online",
      "publisher": "Intuit Developer",
      "url": "https://developer.intuit.com/app/developer/qbo/docs/learn/learn-quickbooks-online-basics",
      "accessedOn": "2026-08-08",
      "notes": "Company preferences, class, department, currency, numbering, and inventory-setting overview."
    },
    {
      "id": "intuit.inventory",
      "title": "Items and inventory in QuickBooks Online",
      "publisher": "Intuit Developer",
      "url": "https://developer.intuit.com/app/developer/qbo/docs/learn/learn-basic-bookkeeping/manage-inventory",
      "accessedOn": "2026-08-08",
      "notes": "Item types, FIFO behaviour, account prerequisites, product conditions, and documented create/query support."
    },
    {
      "id": "intuit.projects",
      "title": "Manage projects",
      "publisher": "Intuit Developer",
      "url": "https://developer.intuit.com/app/developer/qbo/docs/workflows/manage-projects",
      "accessedOn": "2026-08-08",
      "notes": "Projects product applicability and supported transaction families."
    },
    {
      "id": "intuit.projects-access",
      "title": "Get Started with the Project API",
      "publisher": "Intuit Developer",
      "url": "https://developer.intuit.com/app/developer/qbo/docs/workflows/manage-projects/get-started",
      "accessedOn": "2026-08-08",
      "notes": "Premium partner-tier, OAuth scope, company-preference, REST, and GraphQL access conditions."
    },
    {
      "id": "intuit.scopes",
      "title": "Learn about scopes",
      "publisher": "Intuit Developer",
      "url": "https://developer.intuit.com/app/developer/qbo/docs/learn/scopes",
      "accessedOn": "2026-08-08",
      "notes": "Accounting and restricted GraphQL scopes for Projects, Custom Fields, Sales Tax, and Payroll Compensation."
    },
    {
      "id": "intuit.release-notes",
      "title": "QuickBooks Online release notes",
      "publisher": "Intuit Developer",
      "url": "https://developer.intuit.com/app/developer/qbo/docs/release-notes/general-release-notes",
      "accessedOn": "2026-08-08",
      "notes": "Current premium API, dimensions, project budget, custom-field, sales-tax, and payroll/time surface changes."
    },
    {
      "id": "intuit.minor-versions",
      "title": "Minor version summary",
      "publisher": "Intuit Developer",
      "url": "https://developer.intuit.com/app/developer/qbo/docs/learn/explore-the-quickbooks-online-api/minor-versions",
      "accessedOn": "2026-08-08",
      "notes": "REST schema history including recurring-transaction read/create/delete and international tax fields."
    },
    {
      "id": "intuit.ca-users",
      "title": "Add and manage users",
      "publisher": "Intuit QuickBooks Support Canada",
      "url": "https://quickbooks.intuit.com/learn-support/en-ca/account-settings/add-delete-or-change-user-access/00/262171",
      "accessedOn": "2026-08-08",
      "notes": "Canada product workflow for company users, roles, invitations, changes, and deletion."
    },
    {
      "id": "intuit.ca-custom-roles",
      "title": "Add and manage custom roles in QuickBooks Online Advanced",
      "publisher": "Intuit QuickBooks Support Canada",
      "url": "https://quickbooks.intuit.com/learn-support/en-ca/help-article/access-permissions/add-manage-custom-roles-quickbooks-online-advanced/L8Ugph7xl_CA_en_CA",
      "accessedOn": "2026-08-08",
      "notes": "Advanced product workflow and limits for custom roles."
    },
    {
      "id": "intuit.ca-reconcile",
      "title": "Reconcile an account in QuickBooks Online",
      "publisher": "Intuit QuickBooks Support Canada",
      "url": "https://quickbooks.intuit.com/learn-support/en-ca/help-article/reconciliation-reports/reconcile-account-quickbooks-online/L96JWj4je_CA_en_CA",
      "accessedOn": "2026-08-08",
      "notes": "Canada product workflow for statement matching, zero-difference completion, and reconciliation history."
    },
    {
      "id": "intuit.ca-reconcile-report",
      "title": "View, print, or export a reconciliation report",
      "publisher": "Intuit QuickBooks Support Canada",
      "url": "https://quickbooks.intuit.com/learn-support/en-ca/reports/how-do-i-view-print-or-export-a-reconciliation-report/00/262145",
      "accessedOn": "2026-08-08",
      "notes": "Defines reconciliation report contents, static snapshot behaviour, and QBO UI access."
    },
    {
      "id": "intuit.ca-recurring",
      "title": "Create recurring invoices and other transactions in QuickBooks Online",
      "publisher": "Intuit QuickBooks Support Canada",
      "url": "https://quickbooks.intuit.com/learn-support/en-ca/help-article/recurring-transactions/create-recurring-transactions-quickbooks-online/L3WoKX2R8_CA_en_CA",
      "accessedOn": "2026-08-08",
      "notes": "Canada product workflow for scheduled, reminder, and unscheduled templates."
    },
    {
      "id": "intuit.ca-budgets",
      "title": "Create budgets in QuickBooks Online",
      "publisher": "Intuit QuickBooks Support Canada",
      "url": "https://quickbooks.intuit.com/learn-support/en-ca/help-article/taxation/create-import-budgets-quickbooks-online/L7SvmSAsU_CA_en_CA",
      "accessedOn": "2026-08-08",
      "notes": "Canada product workflow for profit-and-loss and balance-sheet budgets."
    },
    {
      "id": "intuit.ca-sales-tax",
      "title": "Set up and use sales tax in QuickBooks Online",
      "publisher": "Intuit QuickBooks Support Canada",
      "url": "https://quickbooks.intuit.com/learn-support/en-ca/help-article/sales-taxes/set-use-sales-tax-quickbooks-online/L4Lx8eL7V_CA_en_CA",
      "accessedOn": "2026-08-08",
      "notes": "Canada product workflow for tax setup, transaction tax, liability review, and filing."
    },
    {
      "id": "intuit.ca-tax-filing",
      "title": "File a sales tax return and record sales tax payments",
      "publisher": "Intuit QuickBooks Support Canada",
      "url": "https://quickbooks.intuit.com/learn-support/en-ca/help-article/remit-sales-taxes/file-sales-tax-return-record-tax-payment-online/L7ZeSlAr1_CA_en_CA",
      "accessedOn": "2026-08-08",
      "notes": "Canada manual filing boundary and QBO payment-recording workflow."
    },
    {
      "id": "intuit.ca-multicurrency",
      "title": "Set up and use Multicurrency in QuickBooks Online",
      "publisher": "Intuit QuickBooks Support Canada",
      "url": "https://quickbooks.intuit.com/learn-support/en-ca/help-article/multicurrency/learn-multicurrency-quickbooks-online/L5krkKQi8_CA_en_CA",
      "accessedOn": "2026-08-08",
      "notes": "Canada product availability, irreversible enablement, and transaction constraints for multicurrency."
    },
    {
      "id": "intuit.ca-custom-fields",
      "title": "Create and edit custom fields",